{
  "schemaVersion": "architecture/v1",
  "id": "graph:archie:reconciled",
  "composition": {
    "policy": "single-repository",
    "inputs": [
      {
        "repository": {
          "repositoryId": "archie",
          "remoteUrl": "https://github.com/Entorn-dev/archie",
          "revision": "ff47bd2954a6505fc41b624751eb8b39266e3133",
          "isDirty": false,
          "contentDigest": "94b692a06491ce114f2671e46a6f612cc55efb37db4e8937d2231d8656e120a5"
        },
        "observationBundleDigest": "c93a8b818d7cc92512c258f4feecf536eea184e232b30539fe07a3e9b793b8b7"
      }
    ]
  },
  "overlayDigest": "640c65866dcf236b0d4f0d5842819f804db77f53819b7ce7bca8a3a3e0158af3",
  "governanceDate": "2026-09-01",
  "nodes": [
    {
      "id": "channel:dispatch-requested",
      "kind": "message-channel",
      "name": "dispatch.requested",
      "resolution": "resolved",
      "aliases": [],
      "properties": {
        "description": "Announces a legacy warehouse dispatch.",
        "environment": "current",
        "glossary": [
          "dispatch: a warehouse shipment hand-off"
        ],
        "onboarding": [
          "Inspect the legacy publisher",
          "Follow notification subscribers"
        ],
        "owner": "team:fulfilment",
        "purpose": "Connect legacy fulfilment to current notifications."
      },
      "evidenceIds": [
        "evidence:legacy-publishes-dispatch",
        "evidence:node:channel:dispatch-requested"
      ]
    },
    {
      "id": "channel:fulfilment-requested",
      "kind": "message-channel",
      "name": "fulfilment.requested",
      "resolution": "resolved",
      "aliases": [],
      "properties": {
        "description": "Hands paid orders to legacy fulfilment.",
        "environment": "legacy",
        "glossary": [
          "fulfilment: preparing an order for shipment"
        ],
        "onboarding": [
          "Trace the current-to-legacy boundary"
        ],
        "owner": "team:fulfilment",
        "purpose": "Bridge current ordering to the legacy warehouse flow."
      },
      "evidenceIds": [
        "evidence:legacy-subscribes-fulfilment",
        "evidence:node:channel:fulfilment-requested"
      ]
    },
    {
      "id": "channel:inventory-reservation",
      "kind": "message-channel",
      "name": "inventory.reservation-requested",
      "resolution": "resolved",
      "aliases": [],
      "properties": {
        "description": "Requests stock reservation.",
        "environment": "current",
        "glossary": [
          "reservation: held stock for a paid order"
        ],
        "onboarding": [
          "Inspect the inventory worker"
        ],
        "owner": "team:inventory",
        "purpose": "Decouple order coordination from stock writes."
      },
      "evidenceIds": [
        "evidence:inventory-subscribes-reservation",
        "evidence:node:channel:inventory-reservation"
      ]
    },
    {
      "id": "channel:order-submitted",
      "kind": "message-channel",
      "name": "order.submitted",
      "resolution": "resolved",
      "aliases": [],
      "properties": {
        "description": "Carries accepted orders into asynchronous processing.",
        "environment": "current",
        "glossary": [
          "submitted order: payment accepted, awaiting processing"
        ],
        "onboarding": [
          "Inspect publisher evidence",
          "Follow Ordering Service"
        ],
        "owner": "team:ordering",
        "purpose": "Begin durable order processing after checkout."
      },
      "evidenceIds": [
        "evidence:checkout-publishes-order-submitted",
        "evidence:node:channel:order-submitted"
      ]
    },
    {
      "id": "database:inventory",
      "kind": "database",
      "name": "Inventory database",
      "resolution": "resolved",
      "aliases": [],
      "properties": {
        "description": "Stores current stock reservations.",
        "environment": "current",
        "glossary": [],
        "onboarding": [
          "Review writes from Inventory Worker"
        ],
        "owner": "team:inventory",
        "purpose": "Persist reservation state."
      },
      "evidenceIds": [
        "evidence:inventory-writes-database",
        "evidence:node:database:inventory"
      ]
    },
    {
      "id": "database:orders",
      "kind": "database",
      "name": "Orders database",
      "resolution": "resolved",
      "aliases": [],
      "properties": {
        "description": "Stores accepted order state.",
        "environment": "current",
        "glossary": [],
        "onboarding": [
          "Review writes from Ordering Service"
        ],
        "owner": "team:ordering",
        "purpose": "Persist the ordering lifecycle."
      },
      "evidenceIds": [
        "evidence:node:database:orders",
        "evidence:ordering-writes-orders"
      ]
    },
    {
      "id": "deployable:catalogue-service",
      "kind": "deployable",
      "name": "Catalogue Service",
      "resolution": "resolved",
      "aliases": [],
      "properties": {
        "description": "Provides books and availability through a Go API.",
        "environment": "current",
        "glossary": [
          "catalogue: saleable book metadata"
        ],
        "onboarding": [
          "Start with the availability endpoint"
        ],
        "owner": "team:catalogue",
        "purpose": "Serve catalogue and availability data."
      },
      "evidenceIds": [
        "evidence:node:deployable:catalogue-service"
      ]
    },
    {
      "id": "deployable:checkout-service",
      "kind": "deployable",
      "name": "Checkout Service",
      "resolution": "resolved",
      "aliases": [],
      "properties": {
        "description": "Accepts checkout requests and submits paid orders.",
        "environment": "current",
        "glossary": [
          "checkout: converting a basket into a paid order"
        ],
        "onboarding": [
          "Read the checkout endpoint",
          "Inspect payment and publish relationships"
        ],
        "owner": "team:checkout",
        "purpose": "Validate baskets, collect payment, and publish accepted orders."
      },
      "evidenceIds": [
        "evidence:checkout-calls-payment",
        "evidence:node:deployable:checkout-service"
      ]
    },
    {
      "id": "deployable:inventory-worker",
      "kind": "deployable",
      "name": "Inventory Worker",
      "resolution": "resolved",
      "aliases": [],
      "properties": {
        "description": "Reserves stock for accepted orders.",
        "environment": "current",
        "glossary": [],
        "onboarding": [
          "Follow the reservation subscription"
        ],
        "owner": "team:inventory",
        "purpose": "Consume reservation requests and persist stock state."
      },
      "evidenceIds": [
        "evidence:inventory-subscribes-reservation",
        "evidence:node:deployable:inventory-worker"
      ]
    },
    {
      "id": "deployable:legacy-fulfilment",
      "kind": "deployable",
      "name": "Legacy Fulfilment Functions",
      "resolution": "resolved",
      "aliases": [],
      "properties": {
        "description": "Legacy Azure Functions coordinating warehouse dispatch.",
        "environment": "legacy",
        "glossary": [
          "legacy boundary: Azure Functions outside the current Kubernetes platform"
        ],
        "onboarding": [
          "Inspect the Service Bus trigger",
          "Follow dispatch publishing"
        ],
        "owner": "team:fulfilment",
        "purpose": "Turn fulfilment requests into warehouse dispatches."
      },
      "evidenceIds": [
        "evidence:legacy-publishes-dispatch",
        "evidence:node:deployable:legacy-fulfilment"
      ]
    },
    {
      "id": "deployable:notification-service",
      "kind": "deployable",
      "name": "Notification Service",
      "resolution": "resolved",
      "aliases": [],
      "properties": {
        "description": "Notifies customers when warehouse dispatch begins.",
        "environment": "current",
        "glossary": [],
        "onboarding": [
          "Inspect the dispatch subscription"
        ],
        "owner": "team:customer-comms",
        "purpose": "Consume dispatch events and notify customers."
      },
      "evidenceIds": [
        "evidence:node:deployable:notification-service",
        "evidence:notifications-subscribes-dispatch"
      ]
    },
    {
      "id": "deployable:ordering-service",
      "kind": "deployable",
      "name": "Ordering Service",
      "resolution": "resolved",
      "aliases": [],
      "properties": {
        "description": "Consumes submitted orders and coordinates fulfilment.",
        "environment": "current",
        "glossary": [
          "ordering: orchestration after payment"
        ],
        "onboarding": [
          "Start at order.submitted",
          "Follow inventory and fulfilment branches"
        ],
        "owner": "team:ordering",
        "purpose": "Persist orders and coordinate inventory and fulfilment."
      },
      "evidenceIds": [
        "evidence:node:deployable:ordering-service",
        "evidence:ordering-publishes-fulfilment"
      ]
    },
    {
      "id": "deployable:storefront",
      "kind": "deployable",
      "name": "Storefront",
      "resolution": "resolved",
      "aliases": [],
      "properties": {
        "description": "TypeScript customer storefront for browsing and checkout.",
        "environment": "current",
        "glossary": [
          "basket: books selected before checkout"
        ],
        "onboarding": [
          "Follow calls to Catalogue and Checkout"
        ],
        "owner": "team:storefront",
        "purpose": "Begin the customer place-an-order journey."
      },
      "evidenceIds": [
        "evidence:node:deployable:storefront",
        "evidence:storefront-calls-checkout"
      ]
    },
    {
      "id": "external:payment-provider",
      "kind": "external-service",